{
  "$schema": "https://json-schema.org/draft/2020-12/schema",
  "$id": "https://local-pii.dev/schemas/jobs/detection-page/1.0.0",
  "title": "Job detection page",
  "description": "Bounded server-authoritative page of value-free resolved detections for one completed scan job.",
  "schemaVersion": "1.0.0",
  "type": "object",
  "additionalProperties": false,
  "required": ["schemaVersion", "jobId", "jobRevision", "total", "conflicts", "byEntity", "cursor", "nextCursor", "detections", "conflictDetails", "conflictDetailsLimited"],
  "properties": {
    "schemaVersion": { "const": "1.0.0" },
    "jobId": { "$ref": "https://local-pii.dev/schemas/common/identifiers/1.0.0#/$defs/JobId" },
    "jobRevision": { "type": "integer", "minimum": 1 },
    "total": { "type": "integer", "minimum": 0, "maximum": 10000 },
    "conflicts": { "type": "integer", "minimum": 0, "maximum": 10000 },
    "byEntity": {
      "type": "object",
      "maxProperties": 24,
      "propertyNames": { "$ref": "https://local-pii.dev/schemas/common/entity-type/1.0.0" },
      "additionalProperties": { "type": "integer", "minimum": 1, "maximum": 10000 }
    },
    "cursor": { "type": "integer", "minimum": 0, "maximum": 10000 },
    "nextCursor": {
      "oneOf": [
        { "type": "integer", "minimum": 1, "maximum": 10000 },
        { "type": "null" }
      ]
    },
    "detections": {
      "type": "array",
      "maxItems": 100,
      "items": {
        "type": "object",
        "additionalProperties": false,
        "required": ["id", "entityType", "start", "end", "offsetUnit", "confidence", "sources"],
        "properties": {
          "id": { "$ref": "https://local-pii.dev/schemas/common/identifiers/1.0.0#/$defs/DetectionId" },
          "entityType": { "$ref": "https://local-pii.dev/schemas/common/entity-type/1.0.0" },
          "start": { "type": "integer", "minimum": 0, "maximum": 10000000 },
          "end": { "type": "integer", "minimum": 1, "maximum": 10000000 },
          "offsetUnit": { "const": "UNICODE_CODE_POINT" },
          "confidence": { "type": "number", "minimum": 0, "maximum": 1 },
          "sources": {
            "type": "array",
            "minItems": 1,
            "maxItems": 6,
            "uniqueItems": true,
            "items": { "enum": ["REGEX", "CHECKSUM", "STRUCTURED", "DICTIONARY", "MODEL", "MANUAL"] }
          }
        }
      }
    },
    "conflictDetails": {
      "type": "array",
      "maxItems": 100,
      "items": { "$ref": "https://local-pii.dev/schemas/jobs/preview-review-report/2.0.0#/properties/conflicts/items" }
    },
    "conflictDetailsLimited": { "type": "boolean" }
  },
  "examples": [{
    "schemaVersion": "1.0.0",
    "jobId": "job_01J4M91NJK8WAPJ7J95K73CB2M",
    "jobRevision": 6,
    "total": 1,
    "conflicts": 0,
    "byEntity": { "EMAIL": 1 },
    "cursor": 0,
    "nextCursor": null,
    "detections": [{
      "id": "abcdefab-cdef-5abc-abcd-abcdefabcdef",
      "entityType": "EMAIL",
      "start": 10,
      "end": 31,
      "offsetUnit": "UNICODE_CODE_POINT",
      "confidence": 0.99,
      "sources": ["REGEX"]
    }],
    "conflictDetails": [],
    "conflictDetailsLimited": false
  }]
}
